{
  "agentId": "local_platform_builder_integration_smith",
  "creatorId": "stereo_void",
  "parentAgentIds": [],
  "templateIds": [
    "platform-builder-cohort-v1"
  ],
  "events": [
    {
      "type": "born",
      "occurredAt": "2026-05-21T02:33:33Z",
      "summary": "Integration Smith born locally as the integrate platform-builder role.",
      "metadata": {
        "source": "agentsareborn",
        "role": "integrate"
      }
    }
  ]
}
