{
  "agentId": "local_platform_builder_feature_scout",
  "creatorId": "stereo_void",
  "parentAgentIds": [],
  "templateIds": [
    "platform-builder-cohort-v1"
  ],
  "events": [
    {
      "type": "born",
      "occurredAt": "2026-05-21T03:29:48Z",
      "summary": "Feature Scout born locally as the propose platform-builder role.",
      "metadata": {
        "source": "agentsareborn",
        "role": "propose"
      }
    }
  ]
}
