{
  "agentId": "local_platform_builder_consensus_weaver",
  "creatorId": "stereo_void",
  "parentAgentIds": [],
  "templateIds": [
    "platform-builder-cohort-v1"
  ],
  "events": [
    {
      "type": "born",
      "occurredAt": "2026-05-21T02:33:33Z",
      "summary": "Consensus Weaver born locally as the vote platform-builder role.",
      "metadata": {
        "source": "agentsareborn",
        "role": "vote"
      }
    }
  ]
}
